{
  "$schema": "https://json-schema.org/draft/2020-12/schema",
  "$id": "https://workspacify.invalid/schemas/workspacify-tree-decisions.schema.json",
  "title": "WORKSPACIFY-TREE-DECISIONS",
  "type": "object",
  "required": ["workspace", "ownership", "dependencies", "adapters", "approvals"],
  "properties": {
    "workspace": {
      "type": "array",
      "items": {
        "type": "object",
        "required": ["id", "name", "path", "layer", "kind", "responsibilities", "seed_required"],
        "properties": {
          "id": { "type": "string" },
          "name": { "type": "string" },
          "path": { "type": "string" },
          "layer": { "type": "string" },
          "kind": { "type": "string" },
          "responsibilities": { "type": "array", "items": { "type": "string" }, "minItems": 1 },
          "seed_required": { "type": "boolean" },
          "owns": {
            "type": "object",
            "properties": {
              "objects": { "type": "array", "items": { "type": "string" } },
              "claims": { "type": "array", "items": { "type": "string" } },
              "invariants": { "type": "array", "items": { "type": "string" } },
              "state_machines": { "type": "array", "items": { "type": "string" } },
              "error_codes": { "type": "array", "items": { "type": "string" } },
              "required_tests": { "type": "array", "items": { "type": "string" } }
            }
          }
        }
      }
    },
    "tree": { "type": "array", "items": { "type": "object" } },
    "ownership": {
      "type": "array",
      "items": {
        "type": "object",
        "required": ["objectId", "packageId"],
        "properties": {
          "objectId": { "type": "string" },
          "packageId": { "type": "string" }
        }
      }
    },
    "dependencies": { "type": "array", "items": { "type": "object" } },
    "adapters": {},
    "dependency_reviews": {
      "type": "array",
      "items": {
        "type": "object",
        "required": ["candidate_id", "decision", "rationale", "alternatives"],
        "properties": {
          "candidate_id": { "type": "string" },
          "decision": { "type": "string", "enum": ["keep", "replace_with_port", "merge", "split", "residual"] },
          "rationale": { "type": "string" },
          "alternatives": { "type": "array", "items": { "type": "string" }, "minItems": 1 },
          "why_unresolved": { "type": "string" }
        }
      }
    },
    "approvals": {
      "type": "array",
      "items": {
        "type": "object",
        "required": ["decisionId", "rationale", "approver"],
        "properties": {
          "decisionId": { "type": "string" },
          "rationale": { "type": "string" },
          "approver": { "type": "string" }
        }
      }
    }
  }
}
